{
  "schema_version": "terminal-sandbox-trace/v0.1",
  "trace_id": "terminaltraj-fixture-contract-001",
  "lane_id": "terminaltraj-production-lane",
  "source": {
    "local_repo": "TerminalTraj",
    "upstream_remote": "https://github.com/multimodal-art-projection/TerminalTraj.git",
    "commit": "01305cbf0425b08b41cf8cfc3e30abb0f4953c27",
    "license": "Apache-2.0"
  },
  "runtime_status": {
    "mode": "fixture_contract",
    "is_real_runtime": false,
    "blockers": [
      "released Docker task instance task_5279 is selected but not run",
      "selected task base Docker image is missing locally",
      "selected task source-license row is unresolved",
      "no validator was executed"
    ]
  },
  "task": {
    "task_id": "task_5279",
    "prompt": "Fixture placeholder bound to released task_5279: modify TubeSync local_settings.py, preserve a backup, create /config/custom_tubesync_data, and write config_test.txt.",
    "domain": "terminal_sandbox_contract",
    "source_instance": "released TerminalTraj task_5279 selected from m-a-p/TerminalTraj-5k-instances, not executed"
  },
  "reset": {
    "status": "not_run",
    "evidence": [
      "TerminalTraj source repo was pinned and task_5279 was extracted into ignored cache, but Docker reset was not run."
    ]
  },
  "observations": [
    {
      "step": 0,
      "kind": "initial_state",
      "content": "Fixture initial observation: a task container would expose a repository workspace, shell, task prompt, and validator entrypoint.",
      "evidence": [
        "TerminalTraj README describes Docker-aligned terminal trajectories and executable validation."
      ]
    }
  ],
  "actions": [
    {
      "step": 1,
      "action_type": "shell_command",
      "raw": "pytest -q",
      "expected_effect": "Run the task validator or test suite inside the task environment.",
      "status": "not_run"
    }
  ],
  "verifier": {
    "status": "not_run",
    "kind": "executable_validator",
    "passed": false,
    "evidence": [
      "task_5279 verifier file was inspected, but was not executed."
    ]
  },
  "final_state": {
    "status": "not_materialized",
    "artifacts": []
  },
  "cleanup": {
    "status": "not_needed_for_fixture",
    "evidence": [
      "No container, process, network service, or temporary task workspace was started."
    ]
  },
  "quality": {
    "evidence_completeness": "contract_only",
    "replay_confidence": "none",
    "failure_category": "runtime_materialization_missing",
    "notes": "This fixture validates the normalized trace shape only. It is not benchmark evidence."
  },
  "export_decision": {
    "local_contract_validation": "allowed",
    "hosted_conversion": "blocked",
    "sft_export": "blocked",
    "training_export": "blocked",
    "reason": "Fixture trace is allowed only to test the adapter contract. It cannot be exported as training or benchmark data because no real task execution, license row, split receipt, or validator output exists."
  }
}
